{
  "$schema": "https://json-schema.org/draft/2020-12/schema",
  "$id": "https://example.com/address.schema.json",
  "title": "Identifier Token Metadata",
  "type": "object",
  "properties": {
    "name": {
      "type": "string",
      "description": "Lion name."
    },
    "description": {
      "type": "string",
      "description": "Lion description."
    },
    "image": {
      "type": "string",
      "description": "A URI pointing to a resource with mime type image/* representing the asset to which this NFT represents. Consider making any images at a width between 320 and 1080 pixels and aspect ratio between 1.91:1 and 4:5 inclusive."
    },
    "properties": {
      "type": "object",
      "description": "Identifier properties",
      "properties": {
        "statusDescription": {
          "type": "string",
          "description": "status field states description"
        },
        "taxonId": {
          "type": "string"
        },
        "conservationStatus": {
          "type": "string"
        },
        "geometry": {
          "type": "string"
        }
      }
    },
    "attributes": {
      "type": "array",
      "description": "Identifier attributes",
      "items": {
        "type": "object",
        "required": ["trait_type", "value"],
        "properties": {
          "trait_type": {
            "type": "string",
            "description": "The name of the trait being displayed."
          },
          "value": {
            "type": ["string", "number"],
            "description": "The value of the trait being displayed."
          }
        }
      },
      "minItems": 1
    }
  }
}
